{
  "schema_version": "1.0",
  "dataset_name": "VRSBench",
  "dataset_version": "v1",
  "root_format": "external",
  "image_path_type": "relative",
  "coordinate_format": "xyxy",
  "coordinate_range": [0, 1],
  "splits": {
    "train": "project_metadata/train.jsonl",
    "validation": "project_metadata/validation.jsonl",
    "test": "project_metadata/test.jsonl",
    "smoke": "project_metadata/smoke.jsonl"
  },
  "statistics": "project_metadata/statistics.json",
  "classes": []
}
